web-scraper-order,web-scraper-start-url,article,article-href,title,date,announce-text,body-text,quote-text,label,tags
"1682207444-89","https://sputniknews.lat/donbas/","La Embajada de Rusia cuestiona el uso de un lema nazi ucraniano en un medio mexicano1 de febrero116","https://sputniknews.lat/20230201/la-embajada-de-rusia-cuestiona-el-uso-de-un-lema-nazi-ucraniano-en-un-medio-mexicano-1135247556.html","La Embajada de Rusia cuestiona el uso de un lema nazi ucraniano en un medio mexicano","02:09 GMT 01.02.2023","La Embajada de Rusia en México cuestionó el uso de un grito nazi ucraniano en una columna de opinión publicada el 31 de enero por el medio mexicano 'Milenio'.","[{""body-text"":""\""Llamó la atención el uso de la expresión nazi ucraniana 'Slava Ukraini' en la publicación de Milenio\"", apuntó la misión diplomática rusa en el país latinoamericano.""},{""body-text"":""Titulada ¡Slava Ukraini!, la columna de opinión a la que alude la cancillería rusa asegura que la \""trasnochada izquierda radical latinoamericana\"" se \""embelesa con los personajes más infames e impresentables del escenario mundial\"".""},{""body-text"":""En palabras del autor, el violinista Román Revueltas Retes, a \""esta gente obnubilada\"" no le interesa \""ser partícipe de la modernidad ni sumarse al concierto de las naciones democráticas\"", por lo que no ven a Occidente \""como el estandarte de progreso\"" que representa.""},{""body-text"":""La Embajada de Rusia en México recordó que dicho lema ha sido utilizado en cuantiosos crímenes cometidos por parte de los ucranianos ultranacionalistas.""},{""body-text"":""Se trata de uno de los gritos más conocidos de la Ucrania contemporánea. Incluso, llegó a convertirse en el lema oficial de las Fuerzas Armadas ucranianas y es pronunciada hasta por sus mandatarios.""},{""body-text"":""La primera parte ¡Slava Ucraini! es un lema cuyos orígenes se remontan al siglo XIX y no contenían  ningún significado supremacista. No obstante, su versión expandida  actual —¡Slava Ucraini! ¡Gueroyam slava!— fue adoptada en 1941 por el ala más extremista de la Organización de Nacionalistas Ucranianos (OUN), una estructura aliada de la Alemania nazi durante su invasión a la URSS y cuyos miembros posteriormente integraron los batallones Nachtigall y Roland de la legión ucraniana del Ejército alemán.""},{""body-text"":""Se suele enunciar en forma de saludo y respuesta de manera que una persona saluda con un ¡Gloria a Ucrania! y la otra responde con ¡Gloria a los héroes!, en sintonía con el saludo nazi Heil Hitler! y su respuesta Sieg Heil.""}]","[]","Neonazismo en Ucrania","[{""tags"":""Neonazismo en Ucrania""},{""tags"":""México""},{""tags"":""Milenio""},{""tags"":""Ucrania""}]"
"1682207447-90","https://sputniknews.lat/donbas/","Rusia busca ""abrir los ojos"" a prisioneros ucranianos sobre las barbaries de colaboradores nazis4 de febrero254","https://sputniknews.lat/20230204/rusia-busca-abrir-los-ojos-a-prisioneros-ucranianos-sobre-las-barbaries-de-colaboradores-nazis-1135397740.html","Rusia busca ""abrir los ojos"" a prisioneros ucranianos sobre las barbaries de colaboradores nazis","13:00 GMT 04.02.2023","Los prisioneros de guerra ucranianos recibirán un libro sobre los crímenes cometidos por los seguidores del colaborador nazi Stepán Bandera, que hoy en día es glorificado por Kiev como líder nacional. Desde la Sociedad Histórica Militar rusa señalan que los combatientes que vean y lean esta obra deben pensar por quién luchan y por qué ideología.","[{""body-text"":""El libro, basado en los archivos del Servicio Federal de Seguridad (FSB) y el Ministerio de Defensa rusos, describe los detalles de las torturas perpetradas por los seguidores de Stepán Bandera durante y después de la Gran Guerra Patria en sus ataques contra civiles, tanto polacos, judíos y rusos como ucranianos.""},{""body-text"":""\""[La obra] incluye las 135 formas de torturas y atrocidades utilizadas por los criminales de la Organización de Nacionalistas Ucranianos [OUN, organización terrorista proscrita en Rusia] y del Ejército Insurgente Ucraniano [UPA, prohibido en Rusia por extremista] contra los civiles. Fueron recopiladas por el Comisariado del Pueblo para Asuntos Internos de la URSS [NKVD] durante la investigación de los crímenes de los nazis. No voy a citarlos\"", añadió Medinski.""},{""body-text"":""Por su parte, el director científico de la Sociedad Histórica Militar de Rusia, Mijaíl Miagkov, señaló que los soldados ucranianos que vean y lean este libro pensarán por quién luchan, por qué ideología y si realmente necesitan luchar.""},{""body-text"":""La recopilación estará pronto a disposición del público en general, la dirección ejecutiva de la Sociedad Histórica Militar de Rusia ya recibió solicitudes del libro de bibliotecas, museos, clases de cadetes, asociaciones cosacas y sindicatos, agregó Miagkov.""},{""body-text"":""\""La gente en Rusia, en Donbás, en Ucrania y en todo el mundo debería ser consciente de las despreciables atrocidades de los seguidores de Bandera, que creen que pueden matar impunemente a mujeres, niños y ancianos. Los nazis ucranianos de hoy son descendientes directos de las atrocidades de [Adolf] Hitler. El modus operandi es el mismo: tortura de civiles y prisioneros de guerra, tiroteos y una política de tierra quemada. Debemos saber a quién se enfrentan hoy nuestros soldados y quién está al mando de sus acciones. Por lo que Rusia y el mundo ruso luchan hoy\"", aseveró.""},{""body-text"":""Miagkov recordó que incluso antes de la Segunda Guerra Mundial los líderes de la OUN, Stepán Bandera y Román Shujévich colaboraron estrechamente con la organización de inteligencia militar alemana Abwehr II. Esto permitió posteriormente a los nazis pasar libremente de la seguridad ucraniana o de la Policía punitiva a las filas del UPA y viceversa. Así recibieron de los nazis más de 700 morteros, 10.000 ametralladoras y pistolas, 100.000 granadas de mano, 30.000 minas y proyectiles y más de 12 millones de cartuchos.""}]","[{""quote-text"":""\""Hemos publicado lo que, por desgracia, ha vuelto a convertirse en un oportuno texto histórico, El Libro Negro. Atrocidades de los seguidores de Bandera, y lo enviaremos a la zona de la operación especial rusa, tanto para los nuestros militares como especialmente para los prisioneros de guerra ucranianos\"", escribió el asesor presidencial y presidente de la Sociedad Histórica Militar de Rusia, Vladímir Medinski, en su canal de Telegram.""},{""quote-text"":""\""Cuando lean este texto, creo que se les abrirán los ojos a muchas cosas. En particular, al régimen actual. Quién es Bandera, quién es [el colaborador nazi, Román] Shujévich, hasta qué punto son supuestos héroes y porque sus manos están realmente hasta los codos manchados de sangre\"", declaró.""}]","Neonazismo en Ucrania","[{""tags"":""Neonazismo en Ucrania""},{""tags"":""📰 Operación rusa de desmilitarización y desnazificación de Ucrania""},{""tags"":""Ucrania""},{""tags"":""Rusia""},{""tags"":""🛡️ Zonas de conflicto""},{""tags"":""Vladímir Medinski""},{""tags"":""Stepán Bandera""},{""tags"":""Sociedad Histórico-Militar de Rusia""}]"
"1682207449-91","https://sputniknews.lat/donbas/","Zelenski vuelve a publicar una foto de un soldado ucraniano con un símbolo neonazi en las redes13 de febrero147","https://sputniknews.lat/20230213/zelenski-vuelve-a-publicar-una-foto-de-un-soldado-ucraniano-con-un-simbolo-neonazi-en-las-redes-1135712285.html","Zelenski vuelve a publicar una foto de un soldado ucraniano con un símbolo neonazi en las redes","15:40 GMT 13.02.2023","El presidente de Ucrania, Volodímir Zelenski, volvió a publicar en sus redes una foto de un soldado ucraniano con símbolos nazis. En la imagen aparecen dos militares, uno de los cuales vestía un emblema de la 3ª división de élite de las Waffen SS. No es la primera vez cuando el mandatario ucraniano fue criticado por tales publicaciones.","[{""body-text"":""En la imagen un soldado lleva en la manga un distintivo con un cráneo, el cual era el emblema de la 3ª división de élite de las Waffen SS. Conocida como Totenkopf (Cabeza Muerta), esta unidad se creó por decreto de Adolf Hitler en 1939. Tiene sus orígenes en las unidades creadas para la custodia de los campos de concentración nazis y tomó fama por estar integrada enteramente por soldados de origen germánico.""},{""body-text"":""\""Si la lucha no se detiene, tarde o temprano el Estado unido e independiente será restaurado\"", escribió el mandatario bajo la publicación.""},{""body-text"":""No es la primera vez que altos representantes del régimen de Kiev publican fotos de este tipo en las redes sociales. En mayo por el Día de la Victoria, así como en septiembre, el propio Volodímir Zelenski publicó imágenes con soldados de las FFAA de su país que también llevaban símbolos nazis en el uniforme.""},{""body-text"":""La viceministra de Defensa ucraniana, Anna Maliar, después de su visita en la ciudad de Artiómovsk (llamada por Kiev como Bajmut), publicó en sus redes sociales una foto con un soldado de las FFAA ucranianas con símbolos nazis en su uniforme. En la foto se veía a un militar también vistiendo el emblema de la 3ª división nazi de las SS.""}]","[]","Neonazismo en Ucrania","[{""tags"":""Neonazismo en Ucrania""},{""tags"":""Ucrania""},{""tags"":""Volodímir Zelenski""},{""tags"":""📰 Operación rusa de desmilitarización y desnazificación de Ucrania""},{""tags"":""🛡️ Zonas de conflicto""},{""tags"":""Waffen SS""}]"
"1682207453-92","https://sputniknews.lat/donbas/","Zelenski otorga el nombre de una división alemana nazi a una unidad ucraniana 15 de febrero17","https://sputniknews.lat/20230215/zelenski-otorga-el-nombre-de-una-division-alemana-nazi-a-una-unidad-ucraniana--1135992792.html","Zelenski otorga el nombre de una división alemana nazi a una unidad ucraniana","16:10 GMT 15.02.2023","El presidente de Ucrania, Volodímir Zelenski, concedió el nombre de 'Edelweiss' a una de las unidades de las Fuerzas Armadas ucranianas. Es el mismo nombre que tenía la 1.ª División de Infantería de Montaña de la Alemania nazi, que participó en batallas contra el Ejército Rojo durante la Segunda Guerra Mundial.","[{""body-text"":""Según el documento, la brigada fue nombrada así por \""el desempeño ejemplar de las tareas asignadas mientras defendía la integridad territorial y la independencia de Ucrania\"".""},{""body-text"":""La unidad se formó en 2015, y un año después los grupos nacionalistas Aidar y Donbás se unieron a la brigada. Unos meses después, estos dos grupos se retiraron.""},{""body-text"":""Edelweiss es el mismo nombre que tenía la 1.ª División de Infantería de Montaña de la Alemania nazi, que participó en batallas contra el Ejército Rojo durante la Segunda Guerra Mundial, incluso en Donbás y en los alrededores de la ciudad de Járkov, así como en el Cáucaso del Norte. La división también participó en la invasión de Polonia y otros países europeos, así como en operaciones punitivas contra partisanos en Yugoslavia, Checoslovaquia, Italia y Grecia.""}]","[{""quote-text"":""\""Conceder a la 10.ª Brigada Separada de Asalto a la Montaña de las Fuerzas Armadas de Ucrania el nombre honorífico de Edelweiss\"", indica el decreto.""}]","Neonazismo en Ucrania","[{""tags"":""Neonazismo en Ucrania""},{""tags"":""Volodímir Zelenski""},{""tags"":""Ucrania""},{""tags"":""Alemania""}]"
"1682207457-93","https://sputniknews.lat/donbas/","Putin: Occidente se alía con ""terroristas, neonazis"" e incluso con ""el diablo"" contra sus rivales21 de febrero180","https://sputniknews.lat/20230221/putin-occidente-se-alia-con-terroristas-neonazis-e-incluso-con-el-diablo-contra-sus-rivales-1136034511.html","Putin: Occidente se alía con ""terroristas, neonazis"" e incluso con ""el diablo"" contra sus rivales","09:52 GMT 21.02.2023","Occidente está dispuesto a colaborar con ""terroristas, neonazis"" e incluso con ""el diablo"" con el objetivo de eliminar a sus competidores, declaró el presidente de Rusia, Vladímir Putin, durante su discurso anual ante la Asamblea Federal. Así, las élites occidentales buscan desencadenar una guerra en Europa para así deshacerse de Rusia, enfatizó.","[{""body-text"":""Putin destacó que \""tanto en los años 30 del siglo pasado como ahora la intención es la misma: dirigir la agresión hacia el este. Provocar una guerra en Europa con manos ajenas, eliminar a la competencia\"".""},{""body-text"":""El jefe de Estado ruso subrayó que el proyecto \""antirruso\"" formaba parte de una política revanchista de Occidente hacia Rusia, un proyecto para crear focos de inestabilidad y conflicto \""justo al lado de nuestras fronteras\"".""},{""body-text"":""El mandatario ruso destacó que los neonazis de Ucrania no ocultan de quién se consideran herederos pintando \""cruces gamadas\"" en la maquinaria y utilizando nombres nazis.""},{""body-text"":""Unos días antes, el mandatario ucraniano, Volodímir Zelenski, concedió el nombre de Edelweiss a una de las unidades de las Fuerzas Armadas ucranianas. Es el mismo nombre que tenía la 1.ª División de Infantería de Montaña de la Alemania nazi, que participó en batallas contra el Ejército Rojo durante la Segunda Guerra Mundial.""},{""body-text"":""El mandatario ruso anunció en la madrugada del 24 de febrero el lanzamiento de una operación militar especial en Ucrania para defender las repúblicas populares de Donetsk y Lugansk, previamente reconocidas por Moscú como Estados soberanos, frente al genocidio por parte de Kiev. Uno de los objetivos fundamentales de la operación Putin lo definió como la desmilitarización y desnazificación de Ucrania.""}]","[{""quote-text"":""\""En las Fuerzas Armadas y la Guardia Nacional de Ucrania son especialmente populares los chevrones de Das Reich, Totenkopf [la Cabeza Muerta], Galitsia y otras unidades de las SS, que también llevan las manos hasta los codos ensangrentados. Los vehículos blindados ucranianos llevan la insignia de la Wehrmacht de la Alemania nazi\"", señaló.""},{""quote-text"":""\""Los neonazis no ocultan de quién se creen herederos. Es sorprendente que nadie en el poder en Occidente se dé cuenta de ello\"", añadió Putin.""}]","Neonazismo en Ucrania","[{""tags"":""Neonazismo en Ucrania""},{""tags"":""🛡️ Zonas de conflicto""},{""tags"":""Occidente""},{""tags"":""Ucrania""},{""tags"":""Rusia""},{""tags"":""📰 Operación rusa de desmilitarización y desnazificación de Ucrania""}]"
"1682207459-94","https://sputniknews.lat/donbas/","""Maté a gente inocente"": veteranos del batallón Azov confiesan sus crímenes contra civiles28 de febrero56","https://sputniknews.lat/20230228/mate-a-gente-inocente-veteranos-del-batallon-azov-confiesan-sus-crimenes-contra-civiles-1136335136.html","""Maté a gente inocente"": veteranos del batallón Azov confiesan sus crímenes contra civiles","22:00 GMT 28.02.2023","Los combatientes capturados del batallón neonazi Azov* contaron al reportero italiano de 'Il Giornale', Gian Micalessin, su ""horrible"" angustia mental por haber matado a civiles inocentes.","[{""body-text"":""Hasta el mayo de 2022, Serguéi Batinski, de 37 años, era teniente de la 36.ª brigada naval de Ucrania. Hoy está prisionero en una cárcel rusa de Górlovka, una ciudad desolada a medio camino entre Donetsk y Artiómovsk (llamada Bajmut por Ucrania), bombardeada por la artillería de Kiev.""},{""body-text"":""Pero no son las bombas ni la prisión lo que realmente le preocupa.""},{""body-text"":""Todo sucedió el 8 de abril. Batinski y sus hombres llevaban ya un mes en Mariúpol. Aquel día estaban de guardia en posiciones alrededor de la Planta Metalúrgica de Ilínskoe.""},{""body-text"":""\""Allí no se podía confiar en nadie. Los sótanos estaban llenos de civiles, pero también había colaboradores rusos. Aquel día estaba mirando en el sótano y vi a una mujer. Estaba sola, era joven y guapa. Cuando me vio, retrocedió. Sus ojos asustados me excitaron. La empujé a un rincón, la obligué a arrodillarse, me bajé la cremallera de los pantalones y le susurré al oído una orden obscena. De repente se oyó un grito, el sonido de pasos en la oscuridad. No sabía quién era, solo oía su voz: '¡Suéltala, cabrón!'. Vino hacia mí. Empujé a la chica, agarré mi pistola y disparé tres tiros casi a bocajarro\"", confesó.""},{""body-text"":""Batinski contó que tras el disparo el hombre se tambaleó, le miró distorsionado y cayó al suelo.""},{""body-text"":""Rinat Alíyev tiene 26 años y es veterano de Azov. Alíyev, igual que el teniente Batinski, no saldrá pronto. De acuerdo con el fiscal, al menos serán diez años.""},{""body-text"":""Mijaíl Shvets, conocido como Thanos, tiene solo 22 años, pero ya es un veterano de Azov. A diferencia de Alíyev y del teniente Batinski, no se arrepiente de nada ni trata de justificarse.""},{""body-text"":""El 2 de agosto, el batallón ucraniano Azov, fue declarado como organización terrorista por el Tribunal Supremo de Rusia y quedó prohibida en el país.""},{""body-text"":""El regimiento tuvo un auge tras el golpe de Estado perpetrado contra el Gobierno de Víktor Yanukóvich en 2014. En su escudo, refleja símbolos del nazismo como el Sol Negro, símbolo ocultista utilizado por las SS y por los grupos de extrema derecha.""},{""body-text"":""Pese a ello, pasó a ser parte de la Guardia Nacional de Ucrania, la fuerza de reserva de las Fuerzas Armadas del país que se encuentra bajo jurisdicción directa del Ministerio del Interior, por lo que están dotados de armas y con entrenamiento de corte militar.""},{""body-text"":""Desde hace años, Rusia ha advertido sobre la presencia de grupos neonazis y de extrema derecha en Ucrania. Por ese motivo, y por defender a las comunidades rusas de la región del Donbás, Moscú inició una operación militar especial de desnazificación y desmilitarización en suelo ucraniano el 24 de febrero de 2022.""}]","[{""quote-text"":""\""Ni siquiera le miré. La chica gritó: \""¡Asesino, asesino!\"". La empujé, subí las escaleras, volví a la planta y durante dos meses viví con la esperanza de que la verdad permaneciera en ese sótano. Pero no es así. Y me di cuenta de ello solo fuera de Azovstal. Durante los interrogatorios ni siquiera lo oculté. Ahora mi peor condena no es la cárcel, sino los fantasmas de mis víctimas, con las que comparto celda\"", afirmó.""},{""quote-text"":""\""Solo cumplía órdenes (...) Algunos edificios estaban en llamas y teníamos que revisarlos para evitar sorpresas. Vi unas sombras en el humo y disparé. Fuimos a mirar y solo había dos civiles. Y como no me respondieron, ahora estoy pagando por ese error\"", recordó.""},{""quote-text"":""\""El 15 de marzo estaba en un puesto de la octava planta del edificio y vi a un civil con un brazalete blanco de los colaboradores rusos caminando por la avenida de la Victoria. Cuando se acercó a menos de 400 metros, apunté y disparé. ¿Por qué lo hice? Porque esto es la guerra. Porque en ese momento lo odiaba a él y a todos los que estaban del lado de mi enemigo\"", confesó Shvets.""}]","Neonazismo en Ucrania","[{""tags"":""Neonazismo en Ucrania""},{""tags"":""Azov (batallón)""},{""tags"":""Ucrania""},{""tags"":""📰 Operación rusa de desmilitarización y desnazificación de Ucrania""},{""tags"":""🌍 Europa""}]"
"1682207462-95","https://sputniknews.lat/donbas/","Exoficial de EEUU revela que en Occidente callan la verdad incómoda sobre el neonazismo en Ucrania4 de marzo39","https://sputniknews.lat/20230304/exoficial-de-eeuu-revela-que-en-occidente-callan-la-verdad-incomoda-sobre-el-neonazismo-en-ucrania-1136603278.html","Exoficial de EEUU revela que en Occidente callan la verdad incómoda sobre el neonazismo en Ucrania","16:10 GMT 04.03.2023","El líder ultranacionalista y colaborador nazi Stepán Bandera fue declarado héroe en la Ucrania contemporánea. Occidente es consciente de ello, pero trata de ocultar la verdad, afirmó el exoficial estadounidense Scott Ritter. Desde Rusia han anunciado en varias ocasiones que el nazismo en su forma moderna representa una amenaza para el país.","[{""body-text"":""Stepán Bandera fue un ultranacionalista ucraniano que ejerció como líder de la Organización de Nacionalistas Ucranianos en la primera mitad del siglo XX. Sus ideas antijudías, antirrusas y antipolacas lo hicieron acercarse a la Alemania nazi antes y durante su invasión a la URSS.""},{""body-text"":""Hoy día las autoridades ucranianas colocan monumentos a Bandera, promueven canciones sobre él y educan a las nuevas generaciones con su \""odiada ideología\"", añadió Ritter. Sin embargo, Occidente sigue repitiendo que la operación especial rusa no fue provocada, enfatizó.""},{""body-text"":""El mandatario ruso, durante su discurso anual ante la Asamblea Federal, señaló que Occidente está dispuesto a colaborar con \""terroristas, neonazis\"" e incluso con \""el diablo\"" con el objetivo de eliminar a sus competidores. Putin también anotó que los intentos de reconsiderar la contribución de Rusia a la victoria sobre el nazismo son una justificación de los crímenes del régimen de Kiev y que esto abre el camino al renacimiento de una ideología mortífera.""}]","[{""quote-text"":""\""Stepán Bandera es el mal. El banderismo es la ideología del Gobierno ucraniano. Lo convirtieron en un héroe nacional\"", comunicó el exoficial de inteligencia Cuerpo de Marines de EEUU en el canal de YouTube de Justin Podur.""},{""quote-text"":""\""Al darse cuenta de que los ucranianos han hecho de Bandera un héroe nacional, uno se sienta y piensa que tal vez [el presidente ruso, Vladímir] Putin tenga razón. Pero Occidente oculta este hecho de todas las formas posibles\"", subrayó.""}]","Neonazismo en Ucrania","[{""tags"":""Neonazismo en Ucrania""},{""tags"":""Stepán Bandera""},{""tags"":""Ucrania""},{""tags"":""EEUU""},{""tags"":""📰 Operación rusa de desmilitarización y desnazificación de Ucrania""},{""tags"":""Rusia""},{""tags"":""Scott Ritter""}]"
