web-scraper-order,web-scraper-start-url,article,article-href,title,date,announce-text,body-text,quote-text,label,tags
"1682207386-68","https://sputniknews.lat/donbas/","El abecé del batallón Azov, el neonazismo institucionalizado en Ucrania del que no se habla","https://sputniknews.lat/20220325/el-abece-del-batallon-azov-el-neonazismo-del-que-occidente-no-habla-sobre-el-conflicto-en-ucrania-1123540842.html","El abecé del batallón Azov, el neonazismo institucionalizado en Ucrania del que no se habla","18:26 GMT 25.03.2022","Entre los argumentos del presidente de Rusia, Vladímir Putin, para ordenar una operación militar especial en Ucrania se encuentra la ""desnazificación"" del territorio del país en referencia, entre otras cosas, al Batallón Azov, ¿qué hay detrás de este grupo?","[{""body-text"":""\""El objetivo es proteger a las personas que han estado sufriendo a lo largo de los últimos ocho años vejaciones y genocidio por parte del régimen de Kiev; a tales efectos procuraremos la desmilitarización y la desnazificación de Ucrania, además de llevar a juicio a quienes han perpetrado numerosos crímenes sangrientos contra civiles, entre ellos nacionales de Rusia\"", aseguró Putin al explicar las razones por las cuales el Kremlin decidió lanzar dicha operación militar.""},{""body-text"":""Detrás de estos ataques se encuentra el famoso Batallón Azov. ¿Cómo nació este grupo? ¿Cuál es su ideología? ¿Por qué juegan un papel fundamental en el actual conflicto que se vive en Ucrania? Sputnik te trae los pormenores.""},{""body-text"":""Se trata de un grupo armado abiertamente nazi, de acuerdo con la organización no gubernamental española Al Descubierto, cuya línea de investigación son los grupos de extrema derecha.""},{""body-text"":""El Batallón Azov tuvo un auge tras el golpe de Estado perpetrado contra el Gobierno de Víctor Yanukóvich en 2014. Este grupo forma parte de las la Guardia Nacional de Ucrania —la fuerza de reserva de las Fuerzas Armadas del país que se encuentra bajo jurisdicción directa del Ministerio del Interior— por lo que están dotados de armas y con entrenamiento de corte militar.""},{""body-text"":""Sin embargo, la historia de los grupos neonazis data desde la década de los 30 del siglo pasado, cuando surgieron grupos que buscaban la separación de Ucrania de la entonces URSS bajo los pilares ideológicos del fascismo, siendo la agrupación más reconocida la Organización de Nacionalistas Ucranianos (OUN), creada en 1929, explica el historiador Christian Nader en entrevista con Sputnik.""},{""body-text"":""Esta agrupación, que posteriormente fue bautizada como el Ejército Insurgente Ucraniano (UPA) operó a favor de los nazis en la URSS y cometió crímenes antisemitas. Aunque el grupo desapareció en la década de los 60, tras la independencia de Ucrania, en 1991, la ideología nacionalista volvió a adquirir fuerza y fue así como nacieron partidos como el Congreso de Nacionalistas Ucranianos (KUN) y el Partido Social-Nacional de Ucrania, la semilla del Batallón Azov.""},{""body-text"":""Históricamente, los grupos neonazis ucranianos han tenido poder político pues han operado como brazo armado de algunos partidos, por ejemplo, el grupo Patriotas de Ucrania, que fue registrado como asociación civil en 1996 aunque estuviera conformada principalmente por militares y veteranos de guerra. En 1999 este grupo estuvo ligado al Partido Social-Nacional de Ucrania.""},{""body-text"":""En 2014, Patriotas de Ucrania e integrantes de otros grupos nacionalistas se unieron para formar el Batallón Azov, el cual ha sido ligado a los ataques contra los civiles de las hoy Repúblicas Populares de  Donetsk y Lugansk los cuales, en su totalidad desde 2014, ha cobrado la vida de más de 7.000 personas, la mayoría rusos étnicos.""},{""body-text"":""En su escudo, el Batallón Azov tiene símbolos del nazismo como el Sol Negro, símbolo ocultista utilizado por las SS y por los grupos de extrema derecha. Pese a ello, pasó a ser parte de la Guardia Nacional de Ucrania.""},{""body-text"":""Los grupos ucranianos abiertamente nazis forman parte del Ejército de Ucrania; es decir, están institucionalizados, un proceso que se dio a partir del Gobierno de Petró Poroshenko, entre 2014 y 2019. ¿Cómo pasó esto?""},{""body-text"":""Durante años, explica Nader, los grupos paramilitares fueron financiados por Estados Unidos para orquestar el golpe de Estado al Gobierno de Víctor Yanukóvich; sin embargo, había un problema para los estadounidenses: los fondos de la Secretaría de la Defensa no podían destinarse a grupos abiertamente nazis. Es aquí cuando, explica Nader, empieza su adhesión a las Fuerzas Armadas de Ucrania como miembros de la Guardia Nacional.""},{""body-text"":""\""En este momento comienza el adiestramiento (militar) por parte de Gran Bretaña, de Canadá, de Estados Unidos y el armamento. (El Batallón Azov) no es el único, hay muchos otros  en estos grupos no son el único porque hay muchos otros también tenemos al Batallón Aidar y otros tantos. Suman, se calculan, aproximadamente unas 100.000 personas, una tercera parte del Ejército ucraniano\"", afirma.""},{""body-text"":""El nazismo ucraniano, advierte el historiador, no solamente afecta a dicho país, pues se ha demostrado que elementos del Batallón Azov realizaron labores de entrenamiento y radicalización de los supremacistas blancos en Estados Unidos que estuvieron detrás de la masacre de 11 personas en una Sinagoga de Pittsburgh en 2018.""},{""body-text"":""Polacos, australianos, brasileños se han entrenado con este grupo neonazi en Ucrania, apunta Nader. \""Prácticamente tocan los cinco continentes\"", afirma.""}]","[{""quote-text"":""\""Poco a poco van a regresaron estos personajes de Occidente a Ucrania, los que están vivos, que son mínimos, pero van a sembrar su semilla y su influencia a partir de 1991\"", señala Nader.""}]","Neonazismo en Ucrania","[{""tags"":""Neonazismo en Ucrania""},{""tags"":""Rusia""},{""tags"":""Ucrania""},{""tags"":""📰 Conflicto en el este de Ucrania (2014-2022)""},{""tags"":""💬 Opinión y Análisis""},{""tags"":""🛡️ Fuerzas Armadas""},{""tags"":""Azov (batallón)""},{""tags"":""política""},{""tags"":""seguridad""}]"
"1682207389-69","https://sputniknews.lat/donbas/","¿Qué quiso decir Putin con la ""desnazificación"" de Ucrania y por qué es tan importante?","https://sputniknews.lat/20220227/que-quiso-decir-putin-con-la-desnazificacion-de-ucrania-y-por-que-es-tan-importante-1122349413.html","¿Qué quiso decir Putin con la ""desnazificación"" de Ucrania y por qué es tan importante?","09:50 GMT 27.02.2022","Durante años, Rusia ha pedido a las naciones occidentales que investiguen los casos de abusos contra los derechos humanos, asesinatos y crímenes de guerra cometidos por grupos neonazis ucranianos tras el golpe de Estado de 2014. Moscú señala que muchos de estos casos fueron cometidos contra rusos o personas de habla rusa con total impunidad.","[{""body-text"":""Cuando el presidente ruso, Vladímir Putin, anunció el inicio de una \""operación especial\"" para proteger las Repúblicas Populares de Donetsk (RPD) y Lugansk (RPL) el pasado 24 de febrero, describió sus objetivos como \""la desmilitarización y la desnazificación\"" de Ucrania. El vocero del Kremlin, Dmitri Peskov, explicó más tarde que \""desnazificar\"" significa que Rusia planea liberar a Ucrania de los neonazis, sus partidarios y su ideología.""},{""body-text"":""Moscú ha advertido repetidamente a las naciones extranjeras sobre los numerosos grupos neonazis, algunos paramilitares, que han tomado el control de las calles de Ucrania luego del golpe de Estado del 2014 conocido como el Maidán. Sin embargo, las sucesivas autoridades ucranianas optaron por ignorar las violaciones de derechos humanos cometidas por los grupos radicales.""},{""body-text"":""¿Cuáles han sido estos crímenes?""},{""body-text"":""Mientras en el 2014 los nacionalistas y los neonazis tomaban el poder en todo el país, en algunas ciudades encontraron resistencia del llamado movimiento anti-Maidán que estaba en contra del golpe. Se produjeron enfrentamientos entre neonazis y manifestantes en todo el país, pero lo que sucedió en Odessa el 2 de mayo de 2014 será recordado como una de las páginas más oscuras de la historia de Ucrania.""},{""body-text"":""Tras los enfrentamientos callejeros con los nacionalistas, los manifestantes anti-Maidán se atrincheraron en una sede sindical local. Sus oponentes, respaldados por las nuevas autoridades ucranianas, rodearon el edificio y lo incendiaron con cócteles molotov.""},{""body-text"":""Cuando estalló el incendio en el segundo y tercer piso del edificio, varios cientos de personas atrapadas en el interior intentaban escapar desesperadamente. Diez de ellos cayeron a su muerte; 32 más murieron con graves quemaduras y asfixiados por el humo; 250 personas más lograron escapar de esta trampa mortal con varias heridas cuando los bomberos llegaron al lugar una hora después de que estallara el incendio.""},{""body-text"":""En paralelo al despliegue de tropas regulares para intentar retomar el control de las ciudades de la RPD y la RPL, el nuevo poder de Kiev apoyó la formación de los llamados batallones voluntarios, los más combativos de los cuales están integrados por miembros de grupos paramilitares nacionalistas y neonazis, financiados y equipados por oligarcas ucranianos. Sus miembros a menudo estuvieron involucrados en crímenes de guerra, desde saqueos y violaciones de los civiles hasta tortura y asesinatos de los prisioneros.""},{""body-text"":""Uno de esos batallones, apodado Tornado, fue disuelto en diciembre de 2014 por el propio Kiev luego de numerosos informes de sus crímenes, pero sus miembros nunca fueron procesados y muchos de ellos integraron otros batallones.""},{""body-text"":""Los crímenes de otro notorio batallón de voluntarios, Aidar, fueron investigados, documentados y expuestos por Amnistía Internacional. Sin embargo, sus horribles hechos quedaron impunes. Uno de muchos de esos crímenes fue descubierto por la milicia popular de la RPD cerca de la mina Kommunar, donde desenterraron los cuerpos de cuatro mujeres y varios hombres, todos ellos civiles. Fueron atados, torturados y ejecutados con disparos en la cabeza o decapitados. Se creía que una de las mujeres había sido violada por los combatientes del batallón.""},{""body-text"":""Pero el más conocido de los batallones voluntarios es, sin duda, el Azov, cuyo comandante, Andriy Biletsky (alias Líder Blanco), es un radical de derecha y cofundador del movimiento Asamblea Social-Nacional, nombre que hace una clara alusión al nacionalsocialismo. Más que eso, el símbolo del batallón de voluntarios Azov es una estilización del wolfsangel, utilizado por el Partido Nazi en sus orígenes.""},{""body-text"":""Durante el conflicto en Donbás, los integrantes del batallón Azov participaron activamente en numerosos crímenes de guerra contra la población civil y prisioneros de guerra hasta el punto de que fue considerado de extremista por la UE y EEUU. Nasa de esto ha evitado, no obstante, que aun hoy el Azov oficialmente forme parte de la Guardia Nacional de Ucrania y su comandante la integre en el rango de coronel.""},{""body-text"":""Los extremistas que integran el Gobierno de Kiev también tienen un rico historial de violaciones de los derechos humanos y de comisión de delitos, muchos de ellos recopilados meticulosamente en el Libro blanco de 80 páginas recopilado por el Ministerio de Relaciones Exteriores de Rusia. A mediados de junio de 2014, menos de cinco meses después de tomar el poder, las nuevas autoridades ucranianas comenzaron a violar los derechos de las personas a expresar sus opiniones y la libertad de prensa, realizando registros y detenciones de manifestantes, periodistas y bloqueando la entrada al país de representantes de los medios de comunicación extranjeros.""},{""body-text"":""Las nuevas autoridades de Kiev tampoco rehusaron amenazar y secuestrar a los opositores políticos e incluso legisladores que se opusieron a la guerra contra la RPD y la RPL, así como aquellos que se opusieron al golpe. Algunos de los políticos de la oposición y periodistas independientes fueron asesinados, en algunos casos por los mismos nacionalistas y neonazis, en crímenes que quedaron impunes hasta el día de hoy.""},{""body-text"":""Quizá el caso más sonado fue el asesinato de Oles Buziná, un periodista ucraniano conocido por sus opiniones anti-Maidán y que llamaba a mantener los lazos de amistad con Rusia. Buziná fue asesinado a tiros en Kiev frente a su casa por individuos identificados y posteriormente absueltos. El hecho sucedió solo un día después del asesinato del exdiputado Oleg Kaláshnikov en su casa, también opositor al Maidán.""},{""body-text"":""Otro caso sucedió en julio del 2016, cuando en la capital ucraniana explotó el automóvil en el que se movía el periodista Pável Sheremet, crítico del Gobierno ucraniano. En esta ocasión sí lograron procesar a varios de los asesinos que resultaron ser nacionalistas veteranos de la guerra en el este del país.""},{""body-text"":""Además de permitir que los crímenes de guerra quedaran impunes y perseguir a sus oponentes políticos, los sucesivos poderes ucranianos a menudo alentaron una discriminación en todo el país contra todo lo relacionado con Rusia.""},{""body-text"":""Esta política se manifestó de diversas formas: desde llamamientos relativamente inofensivos para boicotear los productos rusos hasta la prohibición de hablar ruso en espacios públicos, el despido de académicos que enseñaban literatura rusa, la detención y deportación de viajeros rusos sin explicaciones, la prohibición de trabajar en el país a periodistas rusos, el cierre de medios de información rusos, por solo mencionar algunos.""},{""body-text"":""Y, quizá lo más indignante, el permiso explícito de marchas neonazis en las que se glorifican a históricos líderes nacionalistas ucranianos, colaboradores del régimen nazi de Hitler y libremente se escuchan llamados a \""ahorcar a los rusos\"".""}]","[]","Internacional","[{""tags"":""Internacional""},{""tags"":""📰 Operación rusa de desmilitarización y desnazificación de Ucrania""},{""tags"":""Ucrania""},{""tags"":""🌍 Europa""},{""tags"":""neonazismo""},{""tags"":""💬 Opinión y Análisis""}]"
