web-scraper-order,web-scraper-start-url,article,article-href,title,date,announce-text,body-text,quote-text,label,tags
"1682207503-105","https://sputniknews.lat/donbas/","""Cometí un crimen muy cruel"": un neonazi de Azov admite haber profanado el cuerpo de un soldado ruso2 de abril245","https://sputniknews.lat/20230402/cometi-un-crimen-muy-cruel-un-neonazi-de-azov-admite-haber-profanado-el-cuerpo-de-un-soldado-ruso-1137624172.html","""Cometí un crimen muy cruel"": un neonazi de Azov admite haber profanado el cuerpo de un soldado ruso","17:00 GMT 02.04.2023","Un excombatiente del batallón neonazi Azov*, capturado como prisionero de guerra, admitió haber profanado el cadáver de un militar de la República Popular de Donetsk. En sus palabras, lo hizo para dejar un mensaje a las fuerzas rusas que avanzaban y así intentar intimidar a sus militares.","[{""body-text"":""Explicó que había robado dicha arma blanca en una casa privada.""},{""body-text"":""No es la primera vez que los militares ucranianos mostraron \""la naturaleza salvaje del actual régimen de Kiev\"", explicaron desde el Ministerio de Defensa de Rusia. En octubre de 2022 fue publicado un video del asesinato deliberado y metódico de más de 10 militares rusos desarmados e inmovilizados por parte de las FFAA ucranianas con disparos directos en la cabeza. Desde el organismo castrense ruso afirmaron que se trata de una práctica habitual en las FFAA de Ucrania, apoyada activamente por el régimen de Kiev e ignorada ciegamente por sus patrocinadores occidentales.""},{""body-text"":""Otro combatiente del batallón admitió al reportero italiano de Il Giornale, Gian Micalessin, que su peor condena \""no es cárcel, sino los fantasmas de mis víctimas\"".""},{""body-text"":""El soldado neonazi confesó que mató a una mujer disparándole tres veces a bocajarro.""},{""body-text"":""\""Los sótanos estaban llenos de civiles, pero también había colaboradores rusos. Aquel día estaba mirando en el sótano y vi a una mujer. Estaba sola, era joven y guapa. Cuando me vio, retrocedió. Sus ojos asustados me excitaron. La empujé a un rincón, la obligué a arrodillarse, me bajé la cremallera de los pantalones y le susurré al oído una orden obscena. De repente se oyó un grito, el sonido de pasos en la oscuridad. No sabía quién era, solo oía su voz: '¡Suéltala, cabrón!'. Vino hacia mí. Empujé a la chica, agarré mi pistola y disparé tres tiros casi a bocajarro\"", confesó.""},{""body-text"":""El 2 de agosto, el batallón ucraniano Azov fue declarado como organización terrorista por el Tribunal Supremo de Rusia y quedó prohibido en el país. El regimiento tuvo un auge tras el golpe de Estado perpetrado contra el Gobierno de Víctor Yanukóvich en 2014. En su escudo, refleja símbolos del nazismo como el Sol Negro, símbolo ocultista utilizado por las SS y por los grupos de extrema derecha.""},{""body-text"":""* prohibido en Rusia por extremista y terrorista.""}]","[{""quote-text"":""\""Cometí un crimen muy cruel contra el cadáver de un soldado de la República Popular de Donetsk. Me permití tomar su cuerpo, ponerlo en una silla y profanarlo introduciéndole una catana [una espada japonesa larga] para intimidar a las fuerzas [rusas] que avanzaban\"", confesó Anton Shtukin ante las cámaras.""},{""quote-text"":""\""Intenté perforar la zona abdominal, pero no pude porque tenía una chaqueta. Introduje [la espada] en la zona del cuello, donde estaba abierta, la retorcí varias veces y la saqué, la introduje en la zona del corazón, dejando la catana dentro para que se viera\"", admitió el exmiembro del batallón Azov.""},{""quote-text"":""\""Me rendí el 18 de mayo junto con los combatientes de la planta de Azovstal. Confesé todo, pero no sirvió de nada (...) Mis víctimas me despiertan cada noche, me observan desde detrás de las rejas\"", suspira.""}]","Neonazismo en Ucrania","[{""tags"":""Neonazismo en Ucrania""},{""tags"":""Azov (batallón)""},{""tags"":""Ucrania""},{""tags"":""📰 Operación rusa de desmilitarización y desnazificación de Ucrania""},{""tags"":""Rusia""},{""tags"":""🛡️ Zonas de conflicto""}]"
"1682207506-106","https://sputniknews.lat/donbas/","Neonazis de Azov crean su propia reliquia: un tubo con las cenizas de uno de sus comandantes | Foto4 de abril117","https://sputniknews.lat/20230404/neonazis-del-azov-crean-su-propia-reliquia-un-tubo-con-las-cenizas-de-uno-de-sus-comandantes-1137697643.html","Neonazis de Azov crean su propia reliquia: un tubo con las cenizas de uno de sus comandantes | Foto","12:20 GMT 04.04.2023","Un tubo que contiene las cenizas del comandante Nikolái Kravchenko, que era el jefe de la escuela de ideología de Azov*, fue oficializado como reliquia del batallón neonazi. Desde Rusia han señalado sin cesar que una de las tareas de la operación especial es la desnazificación de Ucrania y que el neonazismo representa una amenaza al país.","[{""body-text"":""En las siguientes imágenes aparecen unos graduados de esta escuela rindiendo homenaje a las cenizas de Kravchenko, veterano del regimiento de Azov.""},{""body-text"":""El batallón Azov surgió como una unidad de voluntarios de ideología ultranacionalista radical tras el golpe de Estado que se produjo en Ucrania en febrero de 2014 y luego pasó a formar parte de la Guardia Nacional de ese país. Los combatientes de este batallón están involucrados en crueles torturas y asesinatos. Para los residentes de Donbás, este batallón neonazi se convirtió en un símbolo del infierno y del terror durante muchos años.""},{""body-text"":""Uno de los combatientes neonazis incluso declaró que \""Hitler lo hizo todo bien\"" y llamó a \""asfixiar en cámaras de gas\"" a los habitantes de Donbás y al pueblo ruso. Otro soldado neonazi, capturado como prisionero de guerra, admitió haber profanado el cadáver de un militar de la República Popular de Donetsk.""},{""body-text"":""Desde Rusia señalaron que los crímenes neonazis contra los civiles en Ucrania son una limpieza étnica, acciones de castigo. Agregaron que al apoyar a Kiev, los países occidentales están normalizando el nazismo. El presidente de Rusia, Vladímir Putin, señaló que en ningún lugar del mundo se promueve el nazismo a nivel estatal como en Kiev.""},{""body-text"":""* prohibido en Rusia por extremista y terrorista.""}]","[]","Neonazismo en Ucrania","[{""tags"":""Neonazismo en Ucrania""},{""tags"":""Ucrania""},{""tags"":""🛡️ Zonas de conflicto""},{""tags"":""📰 Operación rusa de desmilitarización y desnazificación de Ucrania""},{""tags"":""Azov (batallón)""}]"
"1682207509-107","https://sputniknews.lat/donbas/","La esposa de un comandante neonazi de Azov gana influencia en Alemania11 de abril185","https://sputniknews.lat/20230411/la-esposa-de-un-comandante-neonazi-de-azov-gana-influencia-en-alemania-1137954005.html","La esposa de un comandante neonazi de Azov gana influencia en Alemania","20:04 GMT 11.04.2023","La esposa de un comandante del batallón neonazi Azov*, Ekaterina Prokopenko, ganó influencia en la política alemana y participó en una mesa redonda en la Cancillería de ese país, informó 'Junge Welt'. Desde Rusia señalan que los combatientes de Azov están involucrados en crueles torturas y asesinatos, entre sus víctimas hay mujeres y adolescentes.","[{""body-text"":""Ekaterina Prokopenko, la esposa del comandante de Azov, Denis Prokopenko, informó de una \""fructífera reunión de trabajo\"" con \""representantes del Ministerio de Exteriores alemán\"", donde se le prometió \""ayuda\"". Según el periódico, Ekaterina Prokopenko se convirtió en una destacada figura política en los países de la OTAN y en 2021 incluso recibió una audiencia del papa Francisco.""},{""body-text"":""Como afirma el artículo, su esposo era miembro de las comunidades neonazis que protagonizaron ataques racistas contra aficionados al fútbol durante la Liga de Campeones de 2015 antes de unirse al Frente Nacional.""},{""body-text"":""Denís Prokopenko, comandante de las fuerzas del grupo neonazi Azov atrincherado en la planta metalúrgica de Azovstal, se popularizó por sus intrépidos videos en los que prometía luchar contra las tropas rusas \""hasta la última gota de sangre\"" y llamaba \""vergonzosos traidores\"" a aquellos combatientes que se rendían. No obstante, el pasado 16 de mayo, tras 82 días de asedio, el propio Prokopenko anunciaba la rendición de las tropas bajo su mando \""para salvaguardar sus vidas\"".""},{""body-text"":""El 20 de mayo de 2022, desde el Ministerio de Defensa de Rusia anunciaron que había tomado el control de la planta Azovstal, el último lugar de concentración de las fuerzas ucranianas en Mariúpol, ciudad en la costa del mar Negro, cercada desde marzo pasado por las fuerzas rusas y la República Popular de Donetsk.""},{""body-text"":""El 2 de agosto de 2022, el batallón ucraniano Azov fue declarado como organización terrorista por el Tribunal Supremo de Rusia y quedó prohibido en el país. El regimiento tuvo un auge tras el golpe de Estado perpetrado contra el Gobierno de Víctor Yanukóvich en 2014. En su escudo, refleja símbolos del nazismo como el Sol Negro, símbolo ocultista utilizado por las SS y por los grupos de extrema derecha.""},{""body-text"":""Desde Rusia señalaron que los crímenes neonazis contra los civiles en Ucrania son una limpieza étnica, acciones de castigo. Al apoyar a Ucrania, los países occidentales están normalizando el nazismo, agregaron. El presidente de Rusia, Vladímir Putin, señaló que en ningún lugar del mundo se promueve el nazismo a nivel estatal como en Kiev.""},{""body-text"":""* prohibido en Rusia por extremista y terrorista.""}]","[{""quote-text"":""\""Desde que [Denis] Prokopenko y sus hordas neonazis, como combatientes de élite en la guerra por poderes de la OTAN contra Rusia, pudieron atacar a sus enemigos no con cuchillos y navajas, sino (…) con armas de alta tecnología\"", escribe Junge Welt.""}]","Neonazismo en Ucrania","[{""tags"":""Neonazismo en Ucrania""},{""tags"":""Ucrania""},{""tags"":""Azov (batallón)""},{""tags"":""Alemania""},{""tags"":""🌍 Europa""}]"
"1682207512-108","https://sputniknews.lat/donbas/","""El patriotismo ya desaparece"": un neonazi ucraniano admite que Kiev lo abandonó12 de abril196","https://sputniknews.lat/20230412/el-patriotismo-ya-desaparece-un-neonazi-ucraniano-admite-que-kiev-lo-abandono-1138031270.html","""El patriotismo ya desaparece"": un neonazi ucraniano admite que Kiev lo abandonó","12:44 GMT 12.04.2023","Ucrania no nos necesita, declaró el neonazi de la brigada 36 del Ejército ucraniano, capturado en 2022 por las tropas rusas, Yevhen Ganzhala. Asegura que lleva un año en cautiverio y su país no ha tomado ninguna medida. Desde Moscú han anunciado repetidamente que en ningún lugar del mundo se promueve el nazismo a nivel estatal, como en Kiev.","[{""body-text"":""Explicó que antes había pertenecido a grupos de redes sociales que reclutaban jóvenes para unirse a los batallones neonazis, se había puesto tatuajes ultranacionalistas en el cuerpo y ahora se arrepentía.""},{""body-text"":""Desde Rusia señalaron que los crímenes neonazis contra los civiles en Ucrania son una limpieza étnica, acciones de castigo. Al apoyar a Ucrania, los países occidentales están normalizando el nazismo, agregaron. El presidente de Rusia, Vladímir Putin, señaló que en ningún lugar del mundo se promueve el nazismo a nivel estatal como en Kiev.""}]","[{""quote-text"":""\""Nuestro patriotismo ya está empezando a desaparecer lentamente, porque llevamos un año en cautividad y ni siquiera se dice nada de nosotros, nadie sabe nada de nosotros. No se preocupan por nosotros. Simplemente, no nos necesitan\"", declaró a Sputnik Yevhen Ganzhala.""},{""quote-text"":""\""Cuando volvamos a Ucrania, nadie volverá al frente. Vamos a dimitir. Intentaré renunciar por motivos de salud. (...) Ya decidí que no serviré más\"", resumió el prisionero.""}]","Neonazismo en Ucrania","[{""tags"":""Neonazismo en Ucrania""},{""tags"":""Ucrania""},{""tags"":""🛡️ Zonas de conflicto""},{""tags"":""📰 Operación rusa de desmilitarización y desnazificación de Ucrania""},{""tags"":""Rusia""}]"
"1682207514-109","https://sputniknews.lat/donbas/","¿Por qué los Acuerdos de Minsk no lograron detener el genocidio en Donbás?10 de abril 2022609","https://sputniknews.lat/20220410/por-que-los-acuerdos-de-minsk-no-lograron-detener-el-genocidio-en-donbas-1124300197.html","¿Por qué los Acuerdos de Minsk no lograron detener el genocidio en Donbás?","22:25 GMT 10.04.2022","Los Acuerdos de Minsk fueron la única oportunidad para una solución diplomática del conflicto en Donbás, región compuesta por las Repúblicas de Donetsk y Lugansk, pero nunca se aplicaron. Entonces surge la pregunta ¿por qué eran necesarios estos acuerdos? ¿Cuáles fueron los principales puntos aprobados y por qué no se aplicaron?","[{""body-text"":""En esta galería, Sputnik te ofrece las respuestas a las interrogantes que fueron clave durante el intento de proceso de conciliación para Donbás.""}]","[]","Donbás. La historia de un genocidio","[{""tags"":""Donbás. La historia de un genocidio""},{""tags"":""Ucrania""},{""tags"":""📰 Conflicto en el este de Ucrania (2014-2022)""},{""tags"":""🌍 Europa""},{""tags"":""📷 Fotos""},{""tags"":""República Popular de Donetsk (RPD)""},{""tags"":""República Popular de Lugansk (RPL)""},{""tags"":""📰 Proceso unionista de Donetsk, Lugansk, Jersón y Zaporozhie""}]"
"1682207517-110","https://sputniknews.lat/donbas/","Maidán-2004: los primeros pasos hacia la fractura de Ucrania y el genocidio11 de abril 202289","https://sputniknews.lat/20220411/1124122739.html","Maidán-2004: los primeros pasos hacia la fractura de Ucrania y el genocidio","07:36 GMT 11.04.2022","En el 2004 Ucrania fue sacudida por su primer Maidán o la Revolución Naranja. Las elecciones demostraron que el pueblo ucraniano tenía diferentes opiniones sobre el futuro de su país. La fractura emergente llevó a la sociedad ucraniana a un enfrentamiento violento, que terminó en el conflicto armado de Donbás.","[{""body-text"":""Sputnik explica cómo y por qué sucedió el Maidán del 2004.Donbás""}]","[]","Donbás. La historia de un genocidio","[{""tags"":""Donbás. La historia de un genocidio""},{""tags"":""revolución naranja""},{""tags"":""📷 Fotos""},{""tags"":""Ucrania""},{""tags"":""🌍 Europa""},{""tags"":""Maidán""},{""tags"":""Donbás""},{""tags"":""Víctor Yanukóvich""},{""tags"":""Víctor Yuschenko""}]"
"1682207519-111","https://sputniknews.lat/donbas/","Ucrania 2013-2014: del Euromaidán a la quema de personas en Odesa11 de abril 20222520","https://sputniknews.lat/20220411/1124117708.html","Ucrania 2013-2014: del Euromaidán a la quema de personas en Odesa","07:40 GMT 11.04.2022","Los disturbios en Ucrania de 2013 y 2014 no solo provocaron un golpe de Estado y la llegada de fuerzas antirrusas al poder, sino que desencadenaron la sangrienta guerra civil en el Donbás que terminó en la intervención de Rusia para poner fin al auge del neonazismo, el genocidio lingüístico y la discriminación de los ucranianos de procedencia rusa.","[{""body-text"":""Sputnik recuerda cómo se desarrolló el génesis de este conflicto desde noviembre de 2013 hasta mayo de 2014.""}]","[]","Donbás. La historia de un genocidio","[{""tags"":""Donbás. La historia de un genocidio""},{""tags"":""📷 Fotos""},{""tags"":""Ucrania""},{""tags"":""📰 Conflicto en el este de Ucrania (2014-2022)""},{""tags"":""Rusia""},{""tags"":""Euromaidán""},{""tags"":""Crimea""}]"
"1682207523-112","https://sputniknews.lat/donbas/","La Ucrania orientral contra la occidental: historia de una división11 de abril 2022658","https://sputniknews.lat/20220411/1124125040.html","La Ucrania orientral contra la occidental: historia de una división","07:52 GMT 11.04.2022","Quizá la principal razón de la división de Ucrania resultó ser la incapacidad de los habitantes de diferentes regiones de llegar a un acuerdo, a un compromiso en cuanto al rumbo de desarrollo de su país. ¿Por qué es así? ¿Cuáles fueron las condiciones previas a la futura división? ¿Qué papel jugó la cuestión lingüística?","[{""body-text"":""En esta galería de fotos te damos las respuestas a estas preguntas.""}]","[]","Donbás. La historia de un genocidio","[{""tags"":""Donbás. La historia de un genocidio""},{""tags"":""📷 Fotos""},{""tags"":""Ucrania""},{""tags"":""división""},{""tags"":""🌍 Europa""},{""tags"":""historia""},{""tags"":""Rusia""},{""tags"":""Crimea""},{""tags"":""📰 Proceso unionista de Donetsk, Lugansk, Jersón y Zaporozhie""}]"
"1682207525-113","https://sputniknews.lat/donbas/","Luke Skywalker se pasó al 'lado oscuro': el actor de 'Star Wars' elogia a unos neonazis ucranianos18 de abril230","https://sputniknews.lat/20230418/luke-skywalker-se-paso-al-lado-oscuro-el-actor-de-star-wars-elogia-a-unos-neonazis-ucranianos-1138293137.html","Luke Skywalker se pasó al 'lado oscuro': el actor de 'Star Wars' elogia a unos neonazis ucranianos","21:20 GMT 18.04.2023","La estrella de Hollywood Mark Hamill, más conocido como Luke Skywalker de la saga de 'Star Wars' ('La Guerra de las galaxias'), acabó cometiendo una metedura de pata durante un video con miembros de las Fuerzas Armadas ucranianas. Y es que estos hablaron con el actor mientras tenían la bandera de los colaboradores ucranianos de la Alemania nazi.","[{""body-text"":""Mark Hamill elogió a los militares ucranianos que, según sus palabras, estaban \""luchando la buena batalla\"" y comparó a las fuerzas ucranianas con los rebeldes de Star Wars.""},{""body-text"":""\""Ha sido un placer reunirme con los valientes operadores de drones ucranianos. Hablamos de los retos a los que se enfrentan a diario, pero también querían hablar de wookiees, granjeros y droides\"", escribió el actor en el tuit.""},{""body-text"":""Sin embargo, algunos internautas se dieron cuenta de la bandera colgada detrás de los soldados ucranianos. Tenían una muy parecida a la del Ejército Insurgente Ucraniano (UPA)*, un grupo nacionalista ucraniano que colaboró con los nazis alemanes durante la Segunda Guerra Mundial y perpetró actos de limpieza étnica contra civiles de ascendencia polaca, judía, rusa, gitana en Volinia y Galitzia Oriental.""},{""body-text"":""La bandera también llevaba el emblema conocido como kolovrat, una variante de la esvástica utilizada a menudo por los seguidores del neopaganismo eslavo y por muchos grupos neonazis.""},{""body-text"":""\""Es triste verte abrazar el 'lado oscuro' en la vida real\"", escribió otra persona.""},{""body-text"":""Irónicamente, muchos de los que elogiaron a Hamill utilizaron la frase \""Slava Ukraini\"" (\""Gloria a Ucrania\""), un saludo adoptado originalmente por la mencionada UPA y utilizado por las personas que cometieron atrocidades indescriptibles durante la Segunda Guerra Mundial. En la actualidad, es muy utilizado por los grupos paramilitares ucranianos, promovidos por el régimen de Kiev.""},{""body-text"":""*Organización extremista prohibida en Rusia.""}]","[{""quote-text"":""\""Mark, yo sé que crees que estás ayudando y haciendo algo bueno y positivo aquí, pero los tipos con los que estás hablando tienen una bandera nazi\"", comentó un usuario de las redes sociales.""}]","Neonazismo en Ucrania","[{""tags"":""Neonazismo en Ucrania""},{""tags"":""👤 Gente""},{""tags"":""Mark Hamill""},{""tags"":""Ucrania""},{""tags"":""📰 Operación rusa de desmilitarización y desnazificación de Ucrania""},{""tags"":""Ejército Insurgente Ucraniano (UPA)""},{""tags"":""Star Wars""}]"
"1682207528-114","https://sputniknews.lat/donbas/","Sociedad Histórica Militar Rusa: los neonazis ucranianos ""no escaparán del castigo""hace 2 días174","https://sputniknews.lat/20230420/sociedad-historica-militar-rusa-los-neonazis-ucranianos-no-escaparan-del-castigo-1138343011.html","Sociedad Histórica Militar Rusa: los neonazis ucranianos ""no escaparán del castigo""","hace 2 días","Rusia tiene una amplia experiencia en la captura y enjuiciamiento de criminales de guerra, incluso muchos años después de finalizados los conflictos, por lo que, tal como sucedió con la Segunda Guerra Mundial, los combatientes ucranianos y sus dirigentes no escaparán de la justicia, declararon a Sputnik desde la Sociedad Histórica Militar Rusa.","[{""body-text"":""Todos los años se celebra en todo el país el Día de la Acción Unificada para conmemorar el genocidio del pueblo soviético a manos de los nazis y sus cómplices durante la Gran Guerra Patria de 1941-1945, como llaman en el espacio postsoviético a la invasión nazi a la URSS durante la Segunda Guerra Mundial. Su objetivo es preservar la verdad histórica sobre los crímenes de los nazis y sus colaboradores contra los civiles soviéticos en el territorio ocupado.""},{""body-text"":""La fecha fue elegida porque el 19 de abril de 1943, el Presídium del Sóviet Supremo de la URSS emitió el Decreto 39 Sobre medidas para castigar a los villanos nazis responsables del asesinato y tortura de civiles soviéticos y prisioneros del Ejército Rojo, por espías, traidores a la patria entre los ciudadanos soviéticos y sus cómplices. Entre 1943 y 1949, se celebraron juicios públicos contra nazis y sus colaboradores en 21 ciudades de todo el país, incluidas Járkov, Donetsk (entonces ciudad de Stalin), Kiev, Sebastopol y Nikolaev.""},{""body-text"":""Rusia publicará en mayo un libro que documenta los crímenes de guerra cometidos por los combatientes ucranianos contra civiles y prisioneros de guerra rusos en el transcurso de la operación especial militar.""},{""body-text"":""El historiador subrayó que el libro también proporcionaría información sobre los primeros juicios a criminales de guerra ucranianos, la mayoría de los cuales reciben duras condenas.""},{""body-text"":""\""Hoy tenemos una moratoria sobre la pena de muerte; sin embargo, los neonazis reciben condenas muy graves: hasta 25 años de cárcel. No estoy seguro de que la mayoría de ellos llegue al final de la condena, en realidad es cadena perpetua. Los juicios están en marcha y esto es solo el principio\"", señaló el interlocutor de la agencia.""},{""body-text"":""Myagkov señaló que Rusia cuenta con una gran experiencia de la época soviética en la captura y enjuiciamiento de criminales de guerra, incluso muchos años después del final de los conflictos, por lo que tanto durante la Gran Guerra Patria, como ahora, los combatientes ucranianos y sus dirigentes no escaparán a la justicia.""},{""body-text"":""\""Los nazis y sus colaboradores fueron buscados y encontrados muchos años después del final de la guerra: en los años 40, 50, 60, incluso en los 90. A los colaboradores de Bandera que se escondían de la justicia en graneros del oeste de Ucrania, los sacaban literalmente de la suciedad, los lavaban y los enviaban a los tribunales\"", declaró Myagkov.""},{""body-text"":""Se espera que la publicación salga a la luz a principios de mayo de 2023.""}]","[{""quote-text"":""\""Hoy, en Rusia, se está preparando el Libro Negro sobre las atrocidades de los colaboradores modernos de [Stepán] Bandera: los neonazis ucranianos. Estas páginas contendrán truculentos relatos de los crímenes cometidos por los combatientes de las distintas Fuerzas de Seguridad Nacional contra civiles en Donbás, Jersón, Zaporozhie y prisioneros de guerra rusos. Algunos de ellos dan incluso miedo leerlos\"", aseguró a Sputnik Mijaíl Miagkov, director científico de la Sociedad Histórica Militar rusa.""}]","Neonazismo en Ucrania","[{""tags"":""Neonazismo en Ucrania""},{""tags"":""Ucrania""},{""tags"":""📰 Operación rusa de desmilitarización y desnazificación de Ucrania""},{""tags"":""Rusia""},{""tags"":""🛡️ Zonas de conflicto""}]"
"1682207530-115","https://sputniknews.lat/donbas/","Las principales etapas de la división territorial en UcraniaInfografíaVer","https://sputniknews.lat/20220411/las-principales-etapas-de-la-division-territorial-en-ucrania-1124232221.html","Las principales etapas de la división territorial en Ucrania","07:48 GMT 11.04.2022","Hasta el siglo XX, las regiones del  este y oeste de Ucrania habían pertenecido a diferentes países.","[{""body-text"":""La parte central, el sur y el este de Ucrania eran territorios del Imperio ruso. En diferentes épocas, las tierras de Ucrania occidental eran parte de Austria-Hungría y Polonia. En 1945 Transcarpatia pasó a formar parte de Ucrania. No fue hasta finales de la Segunda Guerra Mundial cuando estos territorios constituyeron un solo Estado. En 1954, la República Socialista Federativa Soviética de Rusia entregó la provincia de Crimea a la República Socialista Soviética de Ucrania.""},{""body-text"":""Después de la disolución de la Unión Soviética, la región de Crimea formó parte de una Ucrania independiente como la República Autónoma de Crimea. En marzo de 2014, se celebró un referéndum donde la mayoría de los ciudadanos votó a favor de la reunificación con Rusia. El 18 de marzo de 2014, el presidente ruso Vladímir Putin firmó el Tratado sobre la aceptación de la República de Crimea y Sebastopol como partes de la Federación Rusa y el 21 de marzo, el documento fue ratificado por la Asamblea Federal (Parlamento) del país.""}]","[]","Multimedia","[{""tags"":""Multimedia""},{""tags"":""Ucrania""},{""tags"":""Imperio ruso""},{""tags"":""🌍 Europa""},{""tags"":""división""},{""tags"":""📊 Infografía""},{""tags"":""Unión Soviética (URSS)""}]"
